"subject";"sender";"recipients";"body"
"Questions on Current Promotions";"brian.miller@example.com";"support@travelagency.com";"Hi, I'm interested in your summer travel deals. Are there any discounts for booking multiple trips? And, do these apply to international flights? Let me know! Best, Brian."
"Travel Insurance Coverage Details";"anita.kumar@example.com";"support@travelagency.com";"Hi, can you provide details on the coverage for travel insurance? Specifically, are pre-existing conditions covered? I'm planning a multi-trip package. My previous policy was confusing. Thank you, Anita."
"Loyalty Program Points Inquiry";"chris.wong@example.com";"support@travelagency.com";"Hello, I need to check the status of my loyalty points. I haven't seen any updates recently, and I'm worried they might expire soon. Could you confirm? Thanks, Chris."
"Feedback on Recent Stay";"nancy.taylor@example.com";"support@travelagency.com";"Hello, I stayed at your hotel last weekend and had a few issues. The room service was delayed, and the pool was closed without notice. I've called before, but no resolution. Kindly assist. Regards, Nancy."
"Lost Item in Room";"paul.thomas@example.com";"support@travelagency.com";"Hi, I left my laptop charger in room 204 during my recent stay. Could you check the lost and found? I need it urgently. Could you also arrange for shipping if found? Thanks, Paul."
"Family Reunion Booking";"j.smith@gmail.com";"support@travelagency.com";"Hi there, I hope this finds you well. We're trying to book a group trip for our family reunion in August, and I wanted to know if you have any packages for groups of around 15-20 people? Also, my cousin mentioned there might be a discount for booking early? Thanks in advance! Best, John"
"Requesting a Change in Dates";"lucy_walker90@hotmail.com";"support@travelagency.com";"Hello, I need to change my reservation dates from June 12-15 to June 19-22. Can you confirm if these new dates are available and any additional costs? Also, I might need to add an extra night, but I'll confirm soon. Thank you, Lucy"
"Urgent Cancellation Needed";"mark.taylor@outlook.com";"support@travelagency.com";"Good afternoon, Unfortunately, due to an unexpected work commitment, I need to cancel my booking for next month. Could you please process this cancellation and confirm any fees? Also, I may need to rebook for later in the year. Thanks, Mark"
"Special Dietary Needs for Upcoming Trip";"anita.ramirez@gmail.com";"support@travelagency.com";"Hello, I'm traveling with you next week, and I have specific dietary requirements due to allergies. Could you ensure gluten-free options are available on my flight and at the hotel? Also, my husband follows a vegan diet. Thank you so much! Regards, Anita"
"Question About Baggage Allowance";"david_kim@yahoo.com";"support@travelagency.com";"Hi, I wanted to ask about the baggage allowance for my flight next month. What are the size and weight limits for checked and carry-on bags? I'm also planning to bring a surfboard; do I need to book this in advance? Thanks, David"
"Missed Flight Connection";"emily.jones@icloud.com";"support@travelagency.com";"Dear Support, I missed my connecting flight to London yesterday due to a delay in New York. Can you help me rebook at the earliest convenience? My booking reference is ABC123. I'm currently in the airport lounge, waiting for your response. Regards, Emily"
"Refund Request for Double Payment";"paul.green@hotmail.com";"support@travelagency.com";"Hello, I was charged twice for my recent booking (ref: 456DEF). Could you please process a refund for the duplicate payment? I attached the transaction receipts in my previous email. It's quite urgent as it's affecting my credit limit. Thanks, Paul"
"Inquiring About Promotion for Summer Trips";"sandra_moore@gmail.com";"support@travelagency.com";"Hi there, I saw an advertisement for discounted summer trips. Could you provide more details on these promotions and any conditions that apply? I'm planning a family vacation in July and would love to take advantage of any deals. Best, Sandra"
"Clarification on Travel Insurance Coverage";"robert_lee@corporate.com";"support@travelagency.com";"Good morning, I'm reviewing the travel insurance options for my upcoming trip and have some questions. Does the policy cover pre-existing medical conditions, and what about cancellations due to family emergencies? Your clarification would be appreciated. Thank you, Robert"
"Points Redemption Inquiry";"maria.cheng@ymail.com";"support@travelagency.com";"Hello Customer Service, I would like to know how many points I currently have in my loyalty account and if I can use them for an upgrade on my next trip. Also, when do they expire? I've been collecting for a while! Thanks, Maria"
"Feedback on Recent Trip";"henry_adams@live.com";"support@travelagency.com";"Hi, I recently returned from a trip booked through your agency, and I wanted to provide some feedback. While most of the trip was enjoyable, there were a few issues with hotel service that I'd like to discuss. Could someone get back to me on this? Best, Henry"
"Lost and Found Inquiry";"linda.carter@aol.com";"support@travelagency.com";"Dear Team, I left my jacket in the hotel room when I checked out last Sunday. It's a black leather jacket, and I'm hoping it was found. Could you let me know if it's been located and how I might have it returned? Thanks so much, Linda"
"Re: Group Booking Inquiry";"alice.jones@example.com";"support@travelagency.com";"Hi, I hope you’re doing well. I had a quick question about the group booking I inquired about last week. Can we change the room configuration slightly? Actually, wait, before you answer, Sally from our group just mentioned she might need an extra bed in her room. Could you also confirm if breakfast is included? Thanks! Alice"
"Change of Plans for Our Trip";"michael.smith@example.com";"support@travelagency.com";"Hello, I need to change the dates for my upcoming trip because something came up last minute. Originally, we were flying out on the 12th, but now we're thinking the 15th might work better. Also, can we switch the hotel reservation to include an extra night at the end? Let me know if this is possible. Regards, Michael"
"Urgent: Cancellation Needed";"carla.brown@example.com";"support@travelagency.com";"Dear Support, Unfortunately, we need to cancel our trip due to unforeseen circumstances. We had booked the Honeymoon Suite (ref: AB1234) from the 20th to the 27th. Can you please confirm the cancellation policy? It's quite urgent as we're dealing with a family emergency. Thank you, Carla"
"Request for Special Arrangements";"david.lee@example.com";"support@travelagency.com";"Hi there, I hope this finds you well. I’m traveling with my elderly mother, and I’d like to request a room with disability access. Also, could you arrange for an airport pickup service that can accommodate a wheelchair? Let me know if you need any further information. Best, David"
"Question about Baggage Policies";"susan.martinez@example.com";"support@travelagency.com";"Hello, I was wondering if you could provide some details about the baggage policy for my upcoming flight. Are there any fees for checked bags over 23kg? I’m also traveling with a musical instrument, do I need to make any special arrangements? Thanks in advance! Susan"
"Missed Connection - Need Help ASAP";"john.taylor@example.com";"support@travelagency.com";"Hi, I missed my connecting flight due to a delay in the first leg of my journey. My original itinerary was Flight 5678 from JFK to LAX on Oct 10th. Can you help me rebook the next available flight? This is quite urgent. Thanks, John"
"Refund Request for Cancelled Booking";"emily.wilson@example.com";"support@travelagency.com";"Hello, I’m writing to request a refund for a booking I cancelled last week (Booking ref: XYZ789). I haven’t received any confirmation or refund yet. Please let me know the status as soon as possible, as it’s a significant amount and I need it urgently. Thank you, Emily"
"Inquiry About Seasonal Promotions";"frank.harris@example.com";"support@travelagency.com";"Hello, I’m planning a vacation for December and was wondering if you have any promotions or discounts available during the holiday season. Also, are there any group rates if we book for 10 people? Looking forward to your reply. Cheers, Frank"
"Travel Insurance Coverage Query";"lisa.clark@example.com";"support@travelagency.com";"Hi, I’m considering purchasing travel insurance for my upcoming trip and wanted to ask about coverage for pre-existing conditions. Also, does the policy cover trip cancellations due to weather disruptions? Thanks, Lisa"
"Question about Loyalty Points";"paul.evans@example.com";"support@travelagency.com";"Good afternoon, I was checking my loyalty account and noticed that my points haven’t been updated after my last trip. Could you help me with this? Also, when do these points expire? I’d like to use them for my next booking. Best, Paul"
"Feedback on Recent Stay";"nancy.walker@example.com";"support@travelagency.com";"Hi, I recently stayed at your hotel and wanted to provide some feedback. While the room was comfortable, I had some issues with the check-in process. I’ve mentioned this over the phone, but I’d appreciate it if you could look into this matter. Regards, Nancy"
"Lost Item During Stay";"rachel.moore@example.com";"support@travelagency.com";"Hello, I believe I left my Kindle in the room when I checked out on the 5th. Could you please check lost and found? If found, can you arrange to have it shipped to my address? I can cover the shipping costs. Thank you so much! Rachel"
