"subject";"sender";"recipients";"body"
"Re: Group Booking for Family Reunion";"jane.doe@example.com";"support@travelagency.com";"Hi, I've been discussing our family reunion trip with several relatives, and we're having a bit of a debate about the room arrangements. Can we get a mix of double and single rooms? Also, actually, can you confirm if the group discount still applies if we book separately? Thanks!"
"Change of Plans for Upcoming Trip";"michael.smith@domain.com";"support@travelagency.com";"Hello, I need to make a few changes to my booking #A12345. I want to extend the hotel stay by two nights, but I also need to cancel the rental car. If possible, could you shift the flight to a day earlier instead? Thank you in advance!"
"Urgent Cancellation Request";"emily.r@anothermail.com";"support@travelagency.com";"Dear support, due to an unforeseen family emergency, I need to cancel my upcoming trip. It's the booking for November 15th. I understand the cancellation policy, but is there any possibility for a partial refund due to these circumstances? Please advise ASAP."
"Special Assistance Needed for Upcoming Flight";"kumar.raj@example.com";"support@travelagency.com";"Hi, I have a flight booking for next month, and I need to arrange for wheelchair assistance at both departure and arrival airports. Also, I have a dietary restriction—no peanuts—so I hope that can be arranged for the in-flight meal. Thanks in advance for your help!"
"Baggage Policy Clarification";"linda.wong@webmail.com";"support@travelagency.com";"Hello, I'm traveling with my cello and need to know if there's a special baggage policy for musical instruments. Additionally, how does the weight limit affect this? My booking ref is 789XYZ. Thank you!"
"Missed Connection Due to Delay";"richard.muller@quickmail.com";"support@travelagency.com";"Hi, I missed my connecting flight due to the initial flight being delayed. Now I'm stuck at the airport with booking ref 456DEF. Can you assist with rebooking the next available flight? It's quite urgent!"
"Refund Request for Cancelled Trip";"susan.lee@fastmail.com";"support@travelagency.com";"Dear team, I had to cancel my trip last month, and I was assured a refund. However, I haven't received it yet. The booking reference was 123ABC. Can you check the status for me? It’s quite urgent as I need the funds. Thank you."
"Inquiry About Summer Promotion Rates";"tom.jones@oldmail.com";"support@travelagency.com";"Hi there, I saw an advertisement for a summer promotion. Could you provide more details on what this includes? Also, are there additional discounts for groups of 5 or more? Looking forward to your reply. Cheers!"
"Travel Insurance Coverage Query";"isabella.martinez@netmail.com";"support@travelagency.com";"Hello, I'm considering purchasing travel insurance for my upcoming trip. Could you clarify if it covers pre-existing medical conditions? Also, is there an option for multi-trip coverage? Thank you for your assistance."
"Question About Loyalty Program Points";"david.brown@webservice.com";"support@travelagency.com";"Hi, I've been a member of your loyalty program for a while, but I'm a bit confused about how points are calculated. Could you provide a breakdown? Additionally, do points expire if not used within a certain timeframe? Thanks!"
"Feedback on Recent Trip Experience";"carla.jones@personalmail.com";"support@travelagency.com";"Dear support, I recently traveled with your agency, and I wanted to share some feedback. While the accommodation was excellent, there were issues with the airport transfer service, as it was delayed by an hour. I hope this can be addressed. Thank you."
"Lost Item Recovery Assistance";"john.doe@randommail.com";"support@travelagency.com";"Hi, I left my jacket on the flight from NYC to LAX, flight number AA123, on October 5th. It's a black leather jacket with a distinctive red lining. Could you assist with recovering it? I’m willing to cover any shipping costs. Much appreciated!"
"Group Booking Inquiry for Our Family Reunion";"samantha.jones@example.com";"support@travelagency.com";"Hi there,\n\nWe're planning a family reunion trip and need to book flights for 12 adults and 5 children. Could you provide some options? Also, my uncle might join later, so we might need to add him last minute. Can we hold a few seats just in case? Let me know what’s possible.\n\nThanks,\nSamantha\n\nSent from my iPhone"
"Change Request for Upcoming Trip";"john.doe1980@example.net";"support@travelagency.com";"Hello,\n\nI need to change my flight from Boston to Miami on March 15th to March 17th. Additionally, can you update my hotel reservation to reflect this new date? If possible, a late checkout on the last day would be great. Oh, and can we add a car rental to this package? I called earlier but want to confirm in writing.\n\nBest,\nJohn"
"Urgent: Cancellation Due to Weather Alert";"lisa.williams@domain.com";"support@travelagency.com";"Hi,\n\nDue to the severe weather alerts, I need to cancel my trip to Denver scheduled for tomorrow. I understand the policy but hope for a full refund as this is a force majeure situation. Could you expedite this process? Please advise ASAP.\n\nRegards,\nLisa"
"Request for Special Meal Preferences";"rajiv.kumar@example.co.in";"support@travelagency.com";"Dear Support,\n\nI have a flight booked on the 5th of April, and I need to request a vegetarian meal due to my dietary restrictions. Additionally, my wife requires a gluten-free option. Could you please confirm these changes?\n\nThank you,\nRajiv Kumar"
"Baggage Allowance Clarification Needed";"emily.tan@webmail.com";"support@travelagency.com";"Hello,\n\nI’m flying to Tokyo next week and need clarification on the baggage allowance. I have a musical instrument that I wish to carry onboard. Are there any special fees or requirements I should be aware of? Thank you for your assistance.\n\nEmily"
"Missed Connection and Urgent Rebooking";"michael.brown@gmail.com";"support@travelagency.com";"Hi Support,\n\nI missed my connecting flight in Chicago due to a delay. I need immediate assistance to rebook the next available flight to San Francisco. Please use my loyalty points if possible to expedite this process. I’m currently at the airport and need help fast.\n\nThanks,\nMike"
"Refund Request for Duplicate Booking";"natalie.smith@personalmail.org";"support@travelagency.com";"Dear Team,\n\nI accidentally booked the same flight twice for my trip to New York. Could you process a refund for one of these bookings? The reference numbers are 123456 and 654321. I need this resolved quickly due to budget constraints.\n\nAppreciatively,\nNatalie"
"Seeking Information on Group Discounts";"robert.jones@businessmail.com";"support@travelagency.com";"Hello,\n\nI’m organizing a corporate retreat and am interested in any group discounts you might offer for flights and accommodations for a party of 25. Additionally, are there any promotions available for bookings made this month?\n\nRegards,\nRobert"
"Questions About Travel Insurance Coverage";"maria.lopez@workmail.com";"support@travelagency.com";"Hi,\n\nI’m reviewing the travel insurance policy I purchased and have questions about coverage for pre-existing conditions. Specifically, I’m concerned about emergency medical coverage abroad. Can you provide details?\n\nThanks,\nMaria"
"Clarification on Loyalty Points Expiration";"david.lee@freemail.com";"support@travelagency.com";"Dear Support,\n\nI noticed that my loyalty points are due to expire soon. Could you confirm the exact date? I also want to know if there are any upcoming promotions where I can maximize my points before they expire.\n\nThanks,\nDavid"
"Feedback on Recent Hotel Stay";"olivia.green@homemail.com";"support@travelagency.com";"Hello,\n\nI recently stayed at your partnered hotel in Orlando, and I wanted to share my feedback. While the staff was friendly, the room was not up to the expected standard. I have previously contacted your team but have not received a satisfactory resolution. Please address this matter urgently.\n\nBest,\nOlivia"
"Lost Item Inquiry at Airport";"james.carter@anothermail.com";"support@travelagency.com";"Hi,\n\nI left a black backpack at the security checkpoint at JFK airport on October 10th. It contains important documents and my laptop. Could you help recover it and possibly arrange shipping to my address? I appreciate any assistance you can provide.\n\nThank you,\nJames"
"Group Booking Inquiry";"jessica.tan@familyadventures.com";"support@travelagency.com";"Hi there,\n\nI'm coordinating a family reunion trip and we're considering your agency for the arrangements. We have about 15 adults and 10 kids, and we're targeting late June. Could you provide some package options?\n\nAlso, my cousin mentioned something about a group discount she saw last year. Is that still available?\n\nThanks!\nJessica"
"Change Request Urgency";"michael_lee@gmail.com";"support@travelagency.com";"Hello,\n\nI need to make a couple of changes to my booking ref: 7890-LON-1122. I need to move my return flight from 15th to 18th March, and also change the hotel to one with a pool since my kids love swimming. Actually, wait—change the flight to the 19th instead.\n\nThanks,\nMichael"
"Cancellation Due to Illness";"sandra.brown@healthymail.com";"support@travelagency.com";"Hi,\n\nUnfortunately, I need to cancel my upcoming trip due to a family medical emergency. My booking reference is 5567-CAN-3344. I understand there might be a cancellation fee, but could you assist with this process as soon as possible?\n\nAppreciate your help,\nSandra"
"Special Dietary Request";"aaron_mendes@outlook.com";"support@travelagency.com";"Dear Support Team,\n\nI am traveling with your agency next month (Booking Ref: 1234-NYC-5678) and wanted to ensure that my dietary requirements are noted. I am gluten intolerant and would need meals accordingly. Additionally, my wife requires a prayer mat in the room.\n\nThank you,\nAaron"
"Baggage Allowance Clarification";"clara.jones@travelenthusiast.com";"support@travelagency.com";"Hello,\n\nCould you please clarify the baggage allowance for my upcoming flight under booking ref: 4321-TOK-8765? I have a snowboard and need to know if there's an extra fee. Also, can you remind me if it's 23kg or 30kg for checked bags?\n\nBest,\nClara"
"Missed Connection Assistance";"tom_rivers@quickmail.com";"support@travelagency.com";"Hi,\n\nI missed my connecting flight due to a delay in my previous flight (Ref: 9876-LAX-2345). Can you help me book the next available flight? I'm currently stuck at the airport and would appreciate a quick response.\n\nThanks,\nTom"
"Refund Request Due to Service Cancellation";"lucy.wilson@financesecure.com";"support@travelagency.com";"Hi there,\n\nI am writing to request a refund for my canceled trip (Ref: 6543-PAR-9999). The cancellation was due to a sudden change in travel restrictions. Could you let me know the process and how soon I might expect the funds?\n\nThank you,\nLucy"
"Pricing on Summer Deals";"harry.potter@wizardingmail.com";"support@travelagency.com";"Good afternoon,\n\nI came across your website's summer deals and wanted to know if the prices listed are final or if there are additional taxes/fees? We're planning a trip in July, and any discounts for a group of six would be great.\n\nThanks,\nHarry"
"Travel Insurance Inquiry";"elena_garcia@securetravels.com";"support@travelagency.com";"Hi,\n\nI need some information regarding travel insurance for my trip (Ref: 7654-SYD-3210). Does it cover pre-existing medical conditions? Also, we're planning multiple trips this year, so is there a multi-trip option?\n\nThanks in advance,\nElena"
"Loyalty Program Points Issue";"mark.smith@loyalcustomer.com";"support@travelagency.com";"Hello,\n\nI've noticed some discrepancies in my loyalty points after my last trip (Ref: 3456-ROM-1234). Could you check if my points have been correctly updated? Also, when do they expire?\n\nBest regards,\nMark"
"Feedback on Recent Trip";"sophie.martin@feedback.com";"support@travelagency.com";"Dear Customer Service,\n\nI wanted to share feedback about my recent trip (Ref: 1122-BKK-5678). The hotel was wonderful, but the airport transfer was 45 minutes late. I've mentioned this in a previous email but haven't heard back.\n\nThank you for your attention,\nSophie"
"Lost Item Recovery";"daniel.king@lostandfound.com";"support@travelagency.com";"Hi,\n\nI left my Kindle in the seat pocket on my flight from Chicago to New York (Ref: 8765-CHI-4321). Could you assist in locating it? If found, could it be shipped to my home address?\n\nThanks so much,\nDaniel"
